post,comment
"Ever since I came home, my mom's cooking doesn't hit anymore and I feel guilty.
For context, I spent 7 months in Army basic. The whole time I was there, I dreamt of being able to eat my mom's ca kho to and many other things. Also, I thought that Army food was so bad that I would perform better with my mom's cooking.

 When I returned home, I was expecting to relive my childhood through my taste buds, but everything tastes so mid and I have been feeling weaker ever since I got back. She changed what and how she cooked food. She no longer cooks white rice, beef, or mi xao as well as using less salt because my mom and dad are trying to take care of their health.

I tried to stick with their diet by eating larger portions, but I can barely function throughout the day. I often dry heave during workouts, sometimes throughout the day, and have symptoms of hyponatremia. 

Now, I cook my own food or eat out to feel satisfied. It's awful because I feel like I am insulting her cooking. Because of our work schedules, the only time my family meets consistently is at dinner. Sometimes I am too tired to cook, so I just eat out. 

 The other day, she scolded me for drinking liquid IV and coming home with a beef shawarma, saying it was going to damage my kidneys.  I know she cares, but I never knew caring for myself feels like alienating my mom. 

Have you guys ever gone through anything similar? I just wanted to vent and get opinions on this.","As my parents got older, they understandably changed how they ate and the food became less salty.  Now, being in their eighties, it’s changed even more because of their teeth.  

Can you ask her for a favorite dish for a birthday?  

Also, is there room to compromise by eating her cooking occasionally? Eat her cooking, but add salt, and supplement as needed to hit your macros"
"Has anyone else felt cheated out of their culture? If so how have you worked past it?
I grew up in a mostly white area and growing up, I was so ashamed of being Asian. I constantly got made fun of for “stinky food”, for watching anime, for saying words wrong, and just being different. It was especially bad for me because while mostly white, it’s a very liberal area (for America). I constantly had to deal with Asian jokes and was told to just play along to show that it didn’t bother me. Thinking that all race jokes are just jokes, I made a black joke in middle school once and was immediately ostracized for being racist. I genuinely thought being Asian was the worst thing in the world. I spent so much of my childhood whitewashing myself and denying my heritage. I even went out of my way to not get too close to other Asians. 

Now, I’m an adult and I see that anime and Asian food are getting extremely popular. There’s so much anger in me that people I saw make fun of me are now embracing what they made fun of me for. I feel cheated out of a happy childhood where I could learn about my heritage worry free. I’ve been trying to learn Mandarin, and learn more about Taiwanese culture and history. While it’s been great, I still constantly have to remind myself to get rid of the bias I held against Asian for so long. I also constantly have to work past the regret of denying my heritage and shunning other Asian people. 

I’m sure I’m not the only one with this experience. Anyone else gotten past the hurt and feeling cheated? I would love some dialogue on this

Also does anyone have advice on how I might connect with more Asian people? I don’t know if this is too broad of a question but I just feel like I want more friends who share the same pride in being Asian that I’ve been working towards","Not a comment on being ""cheated out"" of your culture, but that thing about food is real.


They'd sh*t on your ethnic food if it's bandwagon to sh*t on it, amd when it becomes a fad, they don't like to be reminded that they once mocked the same food they ""like"" now.


I do remember in the early to mid-2000 when Westerners were mocking Ube because it is a ""weird"" purple food. But after someone made a post of an Ube donut wrapped in edible gold, it suddenly became ""hip"". It's too hip that they label any purple crop as ""Ube"". Like yo, those purple sweet potato from Hawaii are not Ube. Ube is a type of yam, not sweet potato.


Pretty much all the ""Ube boba"" I've had tasted like sweet potato, not purple yam.


Not to sound judgy but none of non-Filipino commercial items I've tasted don't even taste close to purple yam. A lot of times, they just taste like Vanilla with purple food coloring (looking at you TJs) While it would have been nice having Asian culture be popular growing up, I'm not bitter about it because I'm happy that the popularity at least exists now which is not only good for the kids growing up, but also for us now.

In terms of how you can get over it, remember you can't change the past and only move forward which is what you're doing by reconnecting with your heritage. It can also be helpful to spend time with others that validate you and your identity, hence your attempt to connect with others. It'll take some time so be kind to yourself. You can also try therapy especially with an AA therapist.

For how to meet other Asians, it came up recently here: [How did you find your community?](https://www.reddit.com/r/asianamerican/comments/1mm7xql/how_did_you_find_your_community/). Basically, go to meetups and events surrounding your interests."
"Should I raise my boy in Canada or US
33AM, born and raised in mainland China. I moved to Canada for school and have been living here ever since. I'm now married (my wife is also Asian), and we have a 6-month-old baby boy.

I really appreciate how diverse Canada is and how much the government supports multiculturalism.

My company is offering to relocate my family to the U.S., where my salary could potentially double, and there would be more opportunities to grow my career. However, I have some concerns. I want my son to grow up feeling confident and at home, ideally in a place where he sees more people who look like him and where diversity is embraced.

Is this something I should be worried about? I’d really appreciate hearing from others who have been in a similar situation or have lived in both Canada and the U.S.",I would stay in Canada right now with how things are going in the U.S. I feel like a lot of us are actually wishing we could flee to Canada! You have it good. where in canada and where in the US?
"Why does it seem there are so few Singaporean Chinese in the US but countless Hong Kong, Taiwanese, and Mainland Chinese?
My mother is from Singapore and she married my father who is from Hong Kong.

Since I was young, I have only seen or heard of 10 other Chinese people who were either from Singapore or had parents from there but many Chinese people from Hong Kong, Taiwan, or China or had parents from there.","Isn’t Singapore a fairly small and new country? As far as I’m aware, there haven’t been significant issues of famine and/or revolution to chase away portions of their population. There's really not much reason for Singaporeans to immigrate.


The most prominent one I can think of is Kevin Kwan"
"Can I vent for just a moment?
I grew up in Asia then I moved to the USA for Highschool, however living in Asia again for my gap year reinstalled every single Asian Beauty standard right back into my brain. Someone would have to break me to pieces then rebuild me to loosen the chokehold that Asian beauty standards has on me.

Today I forgot my wallet and with the little cash on me I had to choose whether or not I wanted a meal or get a makeup cushion that was on sale, guess which one I chose? Even after getting the cushion I felt disappointed when I realized ""Wait this is my shade"" because I need something lighter.

It takes me about an hour and a half just to get ready for a class reunion; Peel and stretch my double eyelid tape, wait it looks wrong let's peel it off, stick then rip it off and repeat. My double eyelids looked painfully fake so I decided to apply cluster lashes to cover it. My makeup looked great!! However while looking at myself in the mirror, I remembered the last step; To apply my tone up cream, make sure to look pale, lather it on and spread it evenly on both hands, and clean my nails after because it looks white.

Even back in High School in America, I remember applying tone up creams to my body to look paler, ""prettier"" for prom. I'm slowly drowning in the pool that I filled up, but this was influenced by my childhood when  growing up in Asia I was voted the ugliest girl in 5th grade. Actually a classmate from 5th grade managed to recognize me (not at the reunion, randomly in public) and I almost went on a spiral because ""Am I still the ugliest girl? Haven't I changed enough?""

But in reality I have changed a lot, so many people at the reunion could not put a finger on who I was, the guy who recognized me in public was an incredibly close friend whom I spent most my time with back then, which is why he recognized me. Sorry that this got so long but in the end Asian Beauty is a noose that I willingly tighten around my neck. Maybe one day I'll work through my past and my self confidence.

But then again I've only lived in the USA for about 4 years and I feel like no matter how far I am from Asia I will forever hold myself up to their beauty standards. But also I'm still young, I'm about to go into college in the USA and scared shit-less of how I can maintain my tedious routine (I still feel the need to fit the Asian Beauty Standards in America). Even on my college ID, I decided to submit a headshot where I'm wearing my double eyelids not to mention the crazy editing where I look whiter than a paper FML. As I grow older I wish to gain the courage to embrace myself naturally...","I'm an Asian American woman whose spent my life in the US, and as much as Asian Americans are marginalized and underrepresented here, I feel fortunate that Asian *American* beauty standards seem more inclusive and diverse than those in Asian countries. I have pretty thick wavy hair but as a teenager I wished I had the sleek straight hair most Asian girls had and I'd straighten my hair every day, which damaged my hair and also frankly just didn't fit my face shape. I stopped in college after I just didn't have time and have since gotten a lot of compliments on my hair and even see other Asian girls getting perms to *make* their hair wavy, haha. Everyone wants what they don't have I guess.

I don't have good advice to give if you're planning on settling in Asia because I don't have experience there, but if you're planning on spending more time in America, I'd suggest watching more Asian American media content (movies, TV shows, even social media if that's your thing) so you can appreciate the diversity of Asian faces and stories. Actresses like Sandra Oh, Awkwafina, Kelly Marie Tran, and Stephanie Hsu all look quite different from one another but are still celebrated. I get the impression that American culture prefers a more ""natural"" makeup and photo editing look too so it may actually do you a bit of good socially and professionally if you lean into your natural features and take it easy. You'll find most college campuses in the USA are full of young people doing the absolute bare minimum when it comes to personal grooming and dressing.  It was actually a relief from the ridiculous fashion show that was my high school.

In this environment eventually comes the mindset of, ""Why the heck should I try so hard when everyone else looks so schleppy?""

Enjoy, the beauty break.  You can take it up again when it comes time to start your career."
"How to deal with people being racist (perhaps purposefully) within earshot?
A common interaction I come across more than I like is a complete stranger inspecting or glaring at me/my Asian mother and then shortly after, start talking about “too much Asian immigration” or “Asians are.. etc, etc” in PUBLIC SPACES. I usually glare at them but am always left wondering if I can do more to protect myself and my mother or call them out. Literally just today, my family shared a table with this old lady and she started talking about there being “too many immigrants taking up our country’s space” to a complete stranger. This was after she had a convo with my white dad and for the most part of dinner, stared at us like a creep. I did not wave goodbye like my dad did when she said. If anyone could let me know what I could do in situations like this, or other people’s experiences, it would be much appreciated.","I call them out on their racism. It's amusing because calling them racist will likely offend them more than any slur would. It may not change any opinions immediately, but the interaction will certainly stick with them in the future. Because I can guarantee you they absolutely HATE HATE HATE being called racist. Ask her if she is talking about you. Then if she backs off let her know that this is a nation of immigrants and that she needs to seriously reevaluate why she is so ignorant as to who “we the people” are. And if she parrots Christian BS, tell them to read the red words (Jesus talking) in the New Testament. What you do to the least of these, you do to me. 

Basically let her know you clock her as being racist, ignorant and anti-American. I love a little bless your heart patronizing thrown in the sauce"
"How do I respond?
How do I respond to people who ask racist questions to my daughter (22, Asian) that seem innocent to white people? Things like, “Are you going to go back to China to visit someday?” Or making reference to her size and how small she is “since she’s Asian.” I do not think quick on my feet when I want to punch idiots in the throat. The emotions shut down my thinking. I certainly don’t want to be dismissive by saying to her that they didn’t mean it Bla Bla Bla. I asked her if she feels safe telling me about racism she experiences. She said she does but that it’s too much sometimes so she keeps it to herself. I don’t want to interrogate her about how she experiences racism. That doesn’t help but standing up for her in the moment would be the most I could do to show her my support.  What are some quick responses that I can keep filed away in my mind for when this happens again?

I am white and adopted my sweet daughter at 13 months old from China. Thank you in advance for your thoughts. It helps so much.","What you say will make a big impact. White people don't expect white people to call them out on their racism, even if it's a ""microaggression."" I put that in quotes because when you hear it hundreds of times, it's just plain aggressive. 

I would turn it back on them. What makes you ask a question like that? Let them dig themselves in, educate when able, but hold steady and truly challenge them to think outside the pov of the white society and help them to understand the pov of your daughter and you as her mother and what you have noticed being an adoptive mother of a child that is always bothered simply for her race. 

Thank you for sticking up for her and not excusing away all of the bad behavior of others. [deleted]"
"Ni Hao
I grew up in Brooklyn and people would randomly come up to me and say “ni hao.” I took it as fighting words when I was younger as the way they said was accentuated and followed with laughter. When I got older I thought would I take people coming up to me and saying “Ahn young saeyo” as fighting words? But no random person on the street has said the Korean hello to me, ever. A white door knocker came to remind me of the nyc primaries and he started with “ni hao” as soon as I opened the door. I was immediately insulted. I saw how sweaty he was from doing the job and thought maybe he thought this was a good thing to say so I told him, people don’t like that when you automatically say “ni hao” and he said sorry and sounded sincere. But what pains me is that now that my son is out in the world, he told me that while he was at a job interview and going through the hallways to get to the place, a random person said “ni hao” to him and it’s like not only did I have to go through this shit, he’s gotta suffer through this too? What advice would you give to your kid as a parent to deal with this?","A random Ni hao to anybody that remotely looks ""Asian"" is casual racism. No further explanation needed. Don't let the trolls gaslight you into thinking it's ok or that strangers mean no harm. It's not ok because they are assuming something about somebody based on their ethnicity I’ll never forget when some random white lady in Target grabbed me by the arm to tell me that her son LOVES Pokémon, so she really appreciates Asian culture. Mind you, I’m Kazakh. I think the appropriate way to handle these encounters is to respectfully explain how that is offensive and why others may not take it as nicely as they intend. I think with the majority of people who approach like that are trying to be sincere in their own sheltered and un-educated way, they just need a nudge in the right direction. Frustrating nonetheless."
"Seeking Advice: Navigating Subtle Exclusion & Bullying as South Asians in a Predominantly Chinese-American Community
Hi everyone, posting using a throwaway account, as this is a sensitive topic for my family. I’m reaching out to this community with a heavy heart and an open mind, hoping to understand how best to approach a situation that has been increasingly difficult for my family.

We’re a well-educated Indian family—both my wife and I are physicians—and we’ve lived in the U.S. for over 18 years. About a year and a half ago, we moved to a highly ranked public school district in New York, motivated by the reputation of its schools and the promise of a welcoming, intellectually driven neighborhood.

Most of our neighbors here are of Chinese heritage. We were aware of that going in, and honestly, it didn’t concern us in the slightest. Over the years, we’ve had many close friendships with Chinese colleagues in medical school and university—so we anticipated a diverse, respectful environment.

However, the experience we've had here has been unexpectedly isolating. Our child is the only South Asian child in her elementary school class (class composition is 17 Chinese; 2 Caucasian, 1 Indian). An early observation we had was that despite inviting every child in the class to her birthday party, she received only 3 invites in return (1 Chinese classmate, and the 2 Caucasian classmates). We shrugged this off thinking that we were new in the neighborhood, and this hopefully would change with time. However, a year and a half later we still barely get any play date or birthday invites.

When we walk through the neighborhood and greet others, our Chinese neighbors rarely respond—not even a nod or wave—while neighbors of other backgrounds tend to acknowledge us. It’s subtle, but it’s consistent enough that it’s hard to ignore.

More painfully, our daughter was bullied at school by a group of Chinese classmates. One child told her that I (her dad) must be ashamed of her because of how she looks. When confronted by the teacher, the group’s ringleader said she didn’t like how my daughter disagreed with her in class. The incident was reported, and while the school addressed it on some level, we’re left with the deeper discomfort of whether this reflects something broader.

I’m not sure if what we’re experiencing is cultural disconnect, cliquish behavior, or something rooted in bias—but it’s unlike anything we’ve encountered in other communities we’ve lived in. I’d love to hear from others who’ve navigated similar situations:

* Is this something that improves over time with more engagement?
* Are there ways to bridge cultural gaps that feel this resistant?
* At what point do you consider whether a community is simply not the right fit for your family?

Thanks in advance for any thoughts, perspectives, or personal experiences you’re willing to share.","When you say you invited the entire class to your daughter's birthday party and only got 3 invites to other birthday parties, do you know if there were OTHER birthday parties (besides those 3) where your child was excluded? I'm asking because in my experience, some families simply won't do birthday parties so maybe it's not rampant widespread exclusion? In other words, maybe there were 5 parties and and your child was excluded from 2 as opposed to 16 parties? 

Another possibility is that the invite list might have been via WeChat or some other messaging method. Kids might be in other activities where the invite was distributed that way. I can't see a school sending out a custom invite list per party on a parent's behalf.

Hopefully friendship(s) will be formed but if your daughter is miserable about school, I wouldn't wait too long to move. I don't see it as a problem (yet) here in my neck of the woods where there are a lot of Chinese and Indian families co-navigating the school system. I'm Chinese American and grew up in a suburb that was majority White but had a substantial minority of Asians, about equally East and South Asian, and we all ended up being friends with each other. While we did have issues with racism from White peers, I really appreciated that all of us Asians of different ethnicities banded together without any single ethnicity dominating.

I don't think that Chinese Americans or immigrants especially dislike Indians, but in any setting that is very predominantly one race/ethnicity, anyone who is not of that race/ethnicity is going to have a hard time. I can imagine that Chinese immigrant parents who are not fluent in English might feel uncomfortable reaching out to parents who don't know Chinese and prefer to stay in their comfort zone of other fellow Chinese parents. And kids are pretty shallow and will readily pick on people who are visibly different from the majority if their parents don't consciously teach them not to.

I wouldn't begrudge you for wanting to move somewhere with more Indian Americans around because constant feelings of exclusion and singling out are not going to be good for a young person's well-being, while having even some peers who share their background can do a lot of good."
"A sad old Chinese man sits alone in the park after a life of struggle and broken dreams; his daughter now sleeps with a white man, his son dead in a war fighting for supposed democracy, his eldest son an addict.
From the album ""a grain of sand"" music for the struggle by asians in america (1973) by chris kando iijima, joanne nobuko miyamoto, ""charlie"" chin

https://folkways-media.si.edu/docs/folkways/artwork/PAR01020.pdf

---

SIDE 1, BAND 2 (3:42)

WANDERING CHINAMAN

Words: ""Charlie"" Chin,

Music: traditional

    I left my home and my parents
    At the age of twenty-one.
    In a family of eight children,
    I was the youngest son.
    Little choice was left to me
    But to go to a foreign land.
    Oh who will mourn the passing
    Of this wandering Chinaman?

    I arrived in this country
    In 1925.

    A sixteen hour day
    Just to try and stay alive.
    When I'd saved enough
    And thought I was doing fine,
    I lost everything I had
    In the crash of 29.

    Seven long years,
    Gambling was my trade.
    I'd wander from city to city
    On the money that I made.
    When I'd saved enough,
    And thought that I was done,
    Then came a world war,
    In 1941.

    Oh lonely and lonely,
    And lonely was my life.
    I decided to marry,
    And sent away for a wife.
    I settled down to a family,
    No longer could I roam.
    I gave up my dreams
    Of ever reaching home.

    I lost my precious wife
    In 1965.
    Without her loving strength,
    How do I stay alive?
   And as for my daughter, she's gone
    To sleep with a red-haired man,
    And I lost my youngest son
    In the war in Vietnam.

    The letter said he died
    To protect democracy.
    But why he had to go at all
    Is still a mystery to me.
    And as for my eldest son,
    For him there is no hope.
    He turns all his money
    To the man that sells him dope.

    So I sit in this park
    Until the night-time comes.
    And I worry for my daughter,
    And I think about my sons.
    I sit inside this park
    And stare into my hands.
    Oh who will mourn the passing
    Of this wandering Chinaman?","Thanks for sharing, hearing the voices of the Asian American experience during a time (Wars in Vietnam and Korea before it) where Asians weren’t exactly liked in America.

We go to fight in wars with every other American, yet still get treated like shit by many in this country…unless they need our votes.

Also, interesting that all the way back in 1973 and dealing with his Asian daughter sleeping with White guys. Guess I didn’t realize it’s been an issue for a long time in our community. Great hidden gem of a song. Thanks for sharing."
