post,comment
"I’ve failed as a mum.
This is long and I thought I would add in a few details to help the context (not making excuses)

My sister died when she was 7 and I was 5. My mum turned to alcohol as a way to cope. I was severely beaten (as in hair ripped out and punched etc) and neglected. 

I’ve been in 2 violent and abusive relationships. My older 2 sons from the 1st and my youngest special needs son from the second. 

I believe these have contributed to me failing being a good mum. I’m hoping it’s not too late to fix this. 

Okay so I’ve never yelled or got angry at my kids as I never wanted to be like my mum. Due to the DV the boys witnessed I guess I overcompensated. I found a way to get them whatever they wanted. Christmas and Birthdays extra special etc.

Now my eldest has started high school right at the time we escaped and fled to a safe house and I’m going to assume puberty has began…..

My son has turned really mean. He is like a complete different person compared to the first 12 years. He torments his younger brothers and thinks it’s funny. He treats me horribly. For the first time ever, I’ve yelled 😔

He is refusing counselling and just instantly snaps. He is turning 13 and is already a lot taller than me and I’m starting to think that one day he could even become physical with his brothers or me. It feels like the early stages of becoming out of control.

I’ve stuffed up. It’s like I was so focused on being different from my mum but never focused on healing from a traumatic childhood and then all the violence.

How can I fix this? How can I help him feel better? Has anyone gone through similar and their kids have eventually calmed down?

My heart is breaking","Well, yeah, people that come from a history such as yours parent from trauma. They may do the opposite of what happened to them, but it is still not healthy parenting. However, it isn't you who ""failed"", it's life, and your own parents that failed you. Instagram and Reddit and social media in general are full of positive cr@p that talk about ""breaking the abuse cycle"" as if it was as easy as choosing a new haircut, but you can't break that kind of cycle by yourself! You don't have the instruments to do that because you have been in it since you were a child. Cut yourself some slack: it is not your fault, your intentions were 100% from a place of love, and therefore, the failure isn't yours. All you can do is work from here. But you need professional help, especially with a 13yo. Firstly, I’m sorry you’ve been dealt a shitty hand. I can tell you are trying and that you love your kids. 

The first step is to accept that there is a problem. Which you have. You are a good mom for doing the best you could with the knowledge you had. You left the bad situation, you should be proud of yourself. As it has already been said, therapy for you and them is the BEST and necessary. 

Also want to highlight that from one mom to another, you are the parent. I know you are tired, overstimulated and are in need of a huge break and probably just a hug. Please recognize that your body is also probably in fight mode, and it has been your entire life. So please give yourself some grace. You are all these boys have and if you need to get mad and authoritative to make sure these kids get the best care and treatment you’re going to have to give your boy some tough love. Set boundaries, and please stick to them. I yell all the time, we are human. I am just loud in general, if I ever take it “too far” for my standards, the most important thing is to repair by acknowledgement and apologies. 

Their dads have failed YOU and them. They didn’t choose to be the role model that they deserve and needed and the partner and safe place/ security you deserved. Thank you for respecting yourself enough to leave. 

All 13 year olds are gifted at being mean lol. This is when he needs you most. Please find community where you are and seek help. Please make sure he’s not hanging out with shit kids. Sports, kickboxing, mma whatever your local Y has to offer at risk youth. Karate is another good one as it teaches respect and life skills. What are his interests? Lean into them. He loves you, he’s hurting and he has no skills of emotional intelligence. 

Everything starts with you momma. You get yourself help and support, the boys will be okay. It’s your first time living too. Please don’t be hard on yourself. You’ve already kicked some serious ass in this life. Let yourself find a soft place to land, and remember you are important too. Sending love!"
"FIL is way too attached to my 1 year old
I’m not sure if I’m overreacting, but I need some perspective.

My FIL and MIL live nearby and come over every single day. On one hand, I know we’re lucky to have family who love our son. But it’s getting to the point where I feel smothered.

My son just turned one, and my FIL insists on holding him all the time. If the baby fusses, he swoops in and takes him. If we’re playing on the floor, he’ll pick him up. It feels like he can’t just let my son be unless he’s in his arms.

The part that really bothers me is that I work full time, so I already don’t get as much time with my son as I’d like. When I finally have those precious hours, my FIL is right there, monopolizing him. Sometimes I feel like I’m competing with my own FIL for time with my child.

He also makes comments that really undermine me. For example, my son was in his high chair the other day, just moving around a bit (I was sitting right next to him the entire time), and my FIL said, “Give him to me otherwise he will fall off the chair.” Like… what? He was completely safe, strapped in, and I was literally right there. It made me feel like he doesn’t trust me to even watch my own baby.

It’s starting to feel really overbearing and a little disrespectful of my role as his mum. I don’t want to cause family drama, but I also don’t want to keep silently resenting the situation.

Has anyone else dealt with an in-law who is too attached? How did you set boundaries without it blowing up?

Edit: I spoke to my husband in a very non confronting way. He tried to explain that he’s feeling attached because my FIL is going through something (which I’m aware of) and our son is basically his ‘emotional support’ which made me uncomfortable and frankly angry. I explained to him that he just turned one and he’s already someone’s emotional support? That’s not his responsibility. He’s just a baby.",Where is dad when all of this is going on? Is he aware of the problem? Get him on board and then tell parents that you need to set a schedule for visits. Perfectly reasonable considering that you work. Limit the visits to after meals. And when you may need help or want a break. In laws should not be coming over every day. That is way too much. Talk with your husband about what is acceptable (1-2 visits per week?) and then discuss how to implement this.
"12 yr old daughter lied - community service that’s a little… different
I’m principled. I don’t sweat the small stuff but I have rules with the big things. My daughter was given a direction to ask the teacher about some homework. She got out of doing most homework tasks the rest of the class completes by being given a specific worksheet that the teacher would work on with her because she has some specific things she’s working on improving. Neither of us could understand one of the modules so I told her to ask the teacher, so she gets it. 
She didn’t. 
I asked her if she had talked to the teacher. Her response was “yeah I just can’t remember what she said”. Mumma knew. I said ok, let me talk to your teacher because the plan isn’t working. She finally admitted she never asked the teacher… I don’t accept lying. It’s a big deal for me. The teacher is being amazing helping her with this and her efforts shouldn’t be wasted. The point is to learn this stuff. We don’t lie, and we’re not lazy and we ask for help from the people we trust when we need it. 

Cue Punishment. I’m don’t want to take things away anymore. I want to bolster with action so I decided some community service was in order. Then I thought… I’m going to get her to pick up dog poop. We live in an area where people don’t always pick up after their dogs. Too posh to pick up. I don’t care how long it takes, she needs to collect 10 stranger dog poops and dispose of them to save her neighbours shoes and cars. Is that wrong? We have a dog we walk ourselves and we pick up its poop always and tbh we collect random poops too, just a general kindness. But this makes it something she has to do… Is making my daughter do this, wrong?","I’m all about actions have consequences but I think they need to be as natural as possible. There isn’t really a real-world scenario where lying to someone ends in picking up dog poop. I think this punishment will cause resentment towards you to be honest and I think it will just make her get better at lying.

I think it would be better to sit and talk to her… why did she lie in the first place? Did she feel uncomfortable or embarrassed asking the teacher? Did she just forget? I think it’s also important to recognise whether the lying is sporadic or whether it’s becoming a pattern. Just from this example it doesn’t feel devious! 

You need to make it clear that the behaviour you didn’t like was the lying to you, rather than just not asking the teacher but it does seem like there will be a reason for it! 12 is hard especially if you feel like you can’t be totally honest with your parent and it’s only getting worse.

My parents raised me to be totally honest even if I did wrong and everything will get sorted as long as I tell the truth. At 15 I told my mum I was in a sexual relationship and wanted to go on the pill and she took me to the doctors straight away, no judgement and made sure I had condoms and was being safe. 

I also went to parties and tried drugs/alcohol, my parents weren’t happy about it but they created a safe space where I could be honest and I knew I could call them if I didn’t feel safe (which did happen!) and I was honest with where I was which my none of my friends were, they just got really good at lying. That only happened because my parents encouraged honesty and a safe space. I quickly came out of those risky behaviours using my own decision making, unlike a lot of my friends. I still have an excellent relationship with my parents. 

I know they’re extreme examples but the point is if you punish this behaviour with something gross, embarrassing and unrelated without actually talking to her, you’re only pushing her away which will lead to more lying, less trust and a worse relationship in the long-term. This honestly makes no sense to me.

I get that lying is an issue but idk, this feels like a very random and unrelated punishment for the sake of it. Have you tried to work with her on why she didn’t ask the teacher? Was she anxious about it and then lied because she was ashamed?"
"Car seat with longer crotch strap?
Does anyone know of a car seat that has a longer crotch strap? Or a slimmer crotch buckle set up. My child has a muscle/contracture disorder that makes them very stiff - they cannot bend their hips to 90 degrees, and cannot spread their legs to the side, so the strap is effectively too short and the buckle pinches/digs into their legs and makes car time pretty miserable.

Currently using the Graco 4ever deluxe extend2fit because of the extended rear facing leg room (they also cannot bend their knees at all), but will switch to forward facing soon because their legs really don't fit at this point, so looking to see if there is a better option!","Check the manufacturers website to see if they offer straps you can replace 

I would check for groups specific to your child's condition. You will probably get a good amount of recommendations Hey /u/lifeofhatchlings! It looks like you might be new here. 

Important issues are addressed in the [Sub Wikis](https://www.reddit.com/r/Parenting/wiki/index/). They offer a variety of support for different ages, stages, and topics.

Please make yourself familiar with the [Community Rules](https://www.reddit.com/r/Parenting/wiki/parenting_subreddit_rules/). 


*I am a bot, and this action was performed automatically. Please [contact the moderators of this subreddit](/message/compose/?to=/r/Parenting) if you have any questions or concerns.*"
"Two toddler put down advice?
I have a 3.5f and a 2m, they both take about 1.5-2hr naps and I try and put them to nap at about the same time for my own sanity. Lately my son has had a really hard time with bedtime and he wants me there until he falls asleep which can range from 5-30min. 

My daughter just sits and waits while I’m shut in her brother’s room putting him down and I feel bad she’s just out there alone. If I try and leave to put her down while he’s awake he climbs out of bed and cries at the crack of his door until I get him or he falls asleep. Prior to this he just chatted to himself and played with toys in bed after we did the routine. 

I’m wanting to know if I should let him fuss? Let my daughter wait? Any other option I haven’t tried? My husband is on call 6 days a week and can’t consistently be home to help with bed time which makes it difficult.","Some days can she go down first and y’all do story time in her room and then go and put him down. And wait with him until he’s asleep. Or work on letting him fuss it out for a few if you want. Or on days you put him down first can she work on a “special” big sister project? Or watch tv, read books, listen to tonies, etc? Hey /u/Plane-Technician8087! It looks like you might be new here. 

Important issues are addressed in the [Sub Wikis](https://www.reddit.com/r/Parenting/wiki/index/). They offer a variety of support for different ages, stages, and topics.

Please make yourself familiar with the [Community Rules](https://www.reddit.com/r/Parenting/wiki/parenting_subreddit_rules/). 


*I am a bot, and this action was performed automatically. Please [contact the moderators of this subreddit](/message/compose/?to=/r/Parenting) if you have any questions or concerns.*"
"Son invited to a birthday party for his friend and the friend’s twin. Two gifts?
Hi everyone, I am looking for opinions, and hopefully someone who has had experience with us. My son, 8 years old, has a friend who is a Twin. He was invited to their birthday party. My son is “friendly” with the Twin, but not on the same level as his friend. Basically, are we supposed to get gifts for both of the boys? I feel so awkward and I’m not sure what the norm/expectation for this is

Edit to clarify - by “friendly”, I meant that he is nice to him when they have interacted, but are not friends","Yes you know them both, so it’s polite that each person celebrating is to receive their own gift. I would get two gifts. I’d rather spend double the amount and come across as generous, than only buy one gift and risk being thought of as stingy"
"I feel like I'm losing my daughter, and I don't know how to fix it
I'm a 46-year-old transgender man (FTM), divorced with three children. My 16-year-old child and I used to be incredibly close. We've always shared a special bond, at least I thought so. We spend time together weekly, having fun in the community and discussing life. They use they/them pronouns, and I've always respected that. I thought I was doing a good job being present, supportive, and engaged.

Lately, though, everything's changed. Wren has been pulling away. They don't want to see me as often, barely respond to messages, and recently sent me a very intense message saying they're afraid of how I react during serious conversations. They said they avoid talking to me to ""keep the peace."" That I don't take accountability and always blame others. They said I was lucky they were even bothering to talk to me.

It was hard to hear.

What hurts most is that I didn't see it coming. I've been trying so hard to be a good parent. I know I am neurodivergent, which means I often miss emotional cues. I never meant to make them feel unsafe or unheard, but clearly, I have.

Making it harder is the influence of their stepmother. She's very controlling and seems to be pulling more of the strings in their household. My ex-husband doesn't intervene. I'm trying not to blame anyone, but it's hard not to feel like Wren's slipping further away because of that environment.

I've sent them a card with a message acknowledging what they said and explaining myself without making excuses. I included a blank piece of paper and an envelope, just in case they wanted to write back. I'm trying not to push, trying to be patient. Still, I'm also heartbroken and feel like I'm grieving a relationship that might not come back.

Has anyone experienced something similar? I know 16-year-olds often pull away from their parents, but it seemed so sudden to me. They say it’s been bad for a while, but that wasn’t my impression.

I will say this kid does tend to be overdramatic and is often bullied at school because of it. I’m sure that tendency is playing into this. I still don’t know what to do, but wait, and that sucks. I have my own sensitivity, which makes waiting without any due date so difficult.","She said you don’t take accountability and you don’t address this at all. She is straight up being unheard by you. Stop obsessing about the step mom and trying to blame others. When she says you didn’t take accountability, ask about why she feels that way. I feel like there’s a point where every child see’s their parent for what they are"
"Nearly 4 year old out of control!
My son is nearly 4. His behaviour has always been challenging since around 2.5 but now it’s got to the point where I cannot cope!!

It would be a very very long post if I was to write about all the things he does but so you get the gist he is extremely hyperactive at all points of the day, he launches things at me and his baby brother the second he doesn’t like something ie, being told to stop doing something he shouldn’t. He’s launched the baby bouncer, books, big toy cars, tv remote, you name it. He has a god awful scream! Again that he does when he’s being defiant. I try to leave the room away from the noise and he follows me doing it. I have bad ear ache today after a horrendous screaming episode. More recently he’s started, hitting, biting, scratching and kicking me. He is also extremely defiant! 

I have tired countless methods and techniques to try and help him but don’t get anywhere. We are in touch with the childrens centre for support. The GP won’t help. His preschool won’t help as he masks his behaviour while he’s there. I’m in DESPERATE need of help and support. Everyday is so so so hard and his brother is unsafe around him. Any advice or anyone experienced similar please reach out 😢","Hey /u/Small_Exercise9379! It looks like you might be new here. 

Important issues are addressed in the [Sub Wikis](https://www.reddit.com/r/Parenting/wiki/index/). They offer a variety of support for different ages, stages, and topics.

Please make yourself familiar with the [Community Rules](https://www.reddit.com/r/Parenting/wiki/parenting_subreddit_rules/). 


*I am a bot, and this action was performed automatically. Please [contact the moderators of this subreddit](/message/compose/?to=/r/Parenting) if you have any questions or concerns.* is he austic?"
"Basic things a 3rd grader should know? Surprised my son doesn’t.
Despite thriving in traditional subjects such as math, reading, geography etc.. He doesn’t know some basic things I feel “we” knew very young. 

He didn’t know how many days are in each month (not just 30 or 31. But thought certain months had 32 or February had 27). He didn’t know any holidays except Christmas. He still takes like 60-90 seconds to tie each shoe (mainly either just slips them on or wears crocs or flip flops)

So when walking to the bus I like to just talk to him about random stuff (such as months and holidays now). Anyway, any other random things I could bring up to just widen his general common knowledge topics?

Thanks!",Memorize your phone number and make sure he knows how to use a cell phone and landline to make calls Some of you guys just need to read to your kids or watch some pbs kids shows. Basic stuff. Like there's a sesame Street song that lists almost all holidays. Tons of basics that we can take for granted.
"Deciding to have more kids
If you have more than 2 kids, why? 

My husband and I currently have 2 daughters (5&1). 

My husband has always only wanted one kid. I always wanted three.

After having one, he agreed one more would be okay.

Now, after almost two years of having two kids, he said he's willing to talk about the feasability of having a third. 

Now that it's on the table, I've been throwing around the pros and cons. My daughters adore each other. Now that my youngest is getting older, they are the best playmates. My only regret is that I feel like my oldest is getting less because she has to share it with her sister, but she is getting more because she has her, you know? A third would only be more love. More hilarious milestones, more fun. 

Financially we would be fine. I mean, I think we would, we have so much stuff from our first two, we might just need some clothes if it was a boy. I'm a sahm. We are by no means rich, but we live modestly and have what we need and most of what we want. We have a ton of support, but not locally. We live in a nice three bedroom home in a sought after school district. The only thing that we would really need is a new car, my current car can't fit 3 car seats. It's 10 years old and starting to need a lot of work anyways, so maybe that's not the worst. 

I would love a million kids, but 3 seems reasonable. 

Tldr: what made you decide to keep have more kids? Do you feel like each kid gets less because you have more?","Wife and I went back and forth on having 3 for an entire year. We had a bad annual tradition extended family vacation with a 1 year old and 3 year old and swore off having a third.

But then we got home and realized how much we love our own family so much, and the stress was really just vacationing with in-laws, so why not just grow our own family and do our own thing?

So now, third is on the way :) We have 3 and are done. Our first 2 are 17 months apart. My second and third are 6 years apart. We felt content for a long time, and left the door open for more. After a few years, we decided our family wasn’t complete. Now I feel like our family is perfect. 

I don’t feel like any of the kids are getting less. My older 2 are at way different stages of childhood than my baby, so I just don’t really see it that way. We make sure to have individual time with each kid."
"Am I doing too much or too little in terms of gifts?
My son will be 10 this year and I was planning to give him one of those retro video game things (switch knock off) but one thing led to another and I found myself booking a cruise using the funds we usually use for going back home for a month. I decided on a whim that we would travel to a near by country to do a short cruise trip there. He is CRAZY about cruises and in his rare times he is allowed to watch youtube he wants to watch about cruise ships. Not the crazy big ones with amusement parks regular ol ships excites him too. So I booked it and fully paid. There will be a few days in the city we will be doing the cruise from so I also plan to take him to the water park which claims to be the biggest in the south half of the world. It has attractions I know he would want to try.

So now I don't know if I should be giving him the video game thing along with the cruise gift? Cruise is a huge out of comfort zone for me, to travel, to carry all the mental load etc as an autistic single mom is so hard on my nerves so i am doing this for him. I was thinking I can design his birthday like a treasure hunt theme where at the end his gift will be tickets? And game boy thing could be for his next birthday? 

I kinda don't want to do both at the same time because I am afraid he will be glued to the screen during the cruise. But also the airline we will be flying has no entertainment system and he flies easy only because of the planes we used to take had them. So I can totally get the help of the screen.What would you do?","What a wonderful mum you are either gifts are fantastic. I am also a single mum so I can empathise with the stress that travelling alone with your kids can bring. 

I personally would gift the cruise and leave the game boy for another occasion. A cruise is above and beyond"
