post,comment
"Thinking of switching my kid to daycare from family care
I’m a single mom and have been lucky to have my parents look after my daughter while I went back to work for the past two years.  However, I haven’t always gotten along with my Mom and I’d like to distance myself from her. Has anyone switched their kid from having a family member to care from them to full time daycare?  How’d it go for your kid?  How’d it go for yourself?","Hey /u/Realistic-Fondant-20! It looks like you might be new here. 

Important issues are addressed in the [Sub Wikis](https://www.reddit.com/r/Parenting/wiki/index/). They offer a variety of support for different ages, stages, and topics.

Please make yourself familiar with the [Community Rules](https://www.reddit.com/r/Parenting/wiki/parenting_subreddit_rules/). 


*I am a bot, and this action was performed automatically. Please [contact the moderators of this subreddit](/message/compose/?to=/r/Parenting) if you have any questions or concerns.*"
"Feeling defeated
I always felt like my first baby was challenging as an infant. She had hip dysplasia and was in a brace full time for the first 3 months then had to wear one to sleep for 3 months after that. I look back at that time and remember it being tough and emotional. But overall, she was a happy baby. 

Second time around has been so much more challenging. My son has been pretty difficult to settle for his 11 weeks of life. He has only just started having times where the noises he makes is his voice/talking rather than screaming his lungs out, and it really only lasts maybe 5-10 minutes. He’s difficult to get down for a nap, and having a toddler doesn’t really help with that. I’m just really not enjoying this part of our lives and it makes me so sad to admit that. I know it will get better, but it’s hard to see the light at the end of the tunnel when everyday seems to be the same with no change. 
We are heading to the doctors tomorrow because he hasn’t pooed in 4 days, which has made his unsettled times worse. 

Just think I needed to vent and have some other experiences to help me get through this. I don’t want to wish the time away but I really am looking forward to when he’s bigger and hopefully easier to settle and be comforted.","Hey /u/jessicaamegann! It looks like you might be new here. 

Important issues are addressed in the [Sub Wikis](https://www.reddit.com/r/Parenting/wiki/index/). They offer a variety of support for different ages, stages, and topics.

Please make yourself familiar with the [Community Rules](https://www.reddit.com/r/Parenting/wiki/parenting_subreddit_rules/). 


*I am a bot, and this action was performed automatically. Please [contact the moderators of this subreddit](/message/compose/?to=/r/Parenting) if you have any questions or concerns.* I’m sorry this is such a rough time! The transition from one to two was so hard for me. And even knowing it’s going to get better doesn’t take away from how difficult the present is. 

I hope you are able to take some time to yourself to recharge or rest or just sit in peace for a moment. Sending you good vibes 💕"
"Arguing.
Hey all. So, me and my wife were having this discussion.
We have a boy who is a bit challenging to deal with. So he’s a teenager, almost 19. 
He doesn’t mistreat his peers, however he does get into fights in school. 
He fights with us as well. By fighting i mean he’s brutally honest with people, he doesn’t shy away from saying something. The way i see it, he’s strong minded and opinionated. 
He hates studying and school. Like he likes sports and artistic stuff. But math and history don’t get into his head. 
He has also smoked pot and drinks with his peers from time to time. 
I was telling my wife that i don’t like his partying habits, but im not one of those parents who would want their child to be a yes man or be a pushover. 
Esp when he starts dating as he gets older and deals with difficult people and situations, his confrontational attitude is not gonna be so negative. I think people just perceive it that way. So does my wife. She wants him to be what i would describe in a way, timid. She says well behaved. 
I also said that if he doesn’t want to study the usual subjects, he can find something rhat he likes doing and that might pay him well in the future. 
She begs to differ. 
Apart from the partying i support my son. I think his argumentative nature is not inherently bad behaviour as long as he is not bullying someone or something like that. 
My wife compares him to other classmates who are more well behaved and are more reserved. 
I personally think he can be good at design and architecture. 
What say you?","Hey /u/PossibleFront6210! It looks like you might be new here. 

Important issues are addressed in the [Sub Wikis](https://www.reddit.com/r/Parenting/wiki/index/). They offer a variety of support for different ages, stages, and topics.

Please make yourself familiar with the [Community Rules](https://www.reddit.com/r/Parenting/wiki/parenting_subreddit_rules/). 


*I am a bot, and this action was performed automatically. Please [contact the moderators of this subreddit](/message/compose/?to=/r/Parenting) if you have any questions or concerns.*"
"My son and husband are not getting along…
I’m stuck between a rock and a hard place with my 10 yo son and husband. Lately they have not been getting along. I’m not sure if it’s my son going through preteen emotions or what. My husband is stuck with trying to play with our son as if he’s a toddler/younger child. He tries to play rough with him, tickle him, bust his chops and my son just gets annoyed easily. Then my husband gets super upset because our kid is getting upset and I just don’t know what to do. I try to explain to my husband that sometimes he going a bit overboard and doesn’t know when to stop. But then he gets upset with me. And I also try to explain to my son that daddy is just messing around with him and he means well. I also want to say that my son is very sensitive, physically and emotionally. If he stubs his toe or something he cries, especially if there is blood. He gets super emotional if his feelings are hurt. I’m just so over it ugh.","You need to pull your husband aside and get him to understand that he's harassing and infantilizating your son. He either needs to apologize and change his behavior or your son will escalate in his reactions until someone gets actually hurt. Your husband should really chill out, and sounds like he has a bit of growing up to do himself. Getting super upset over how a 10 year old reacts to being messed with is extremely childish."
"UPDATE: Is my child broken or something?
Got a lot of comments and I really appreciated it. 

So today she took the bus without any fuss, we didn't get any message from school and she seems in good spirit eating a bear paw in front of the TV to decompress. So yay?

Most probable explanation for her behavior yesterday was that she acted out only because we were there. Safe space and all that shit I guess.","/u/MissMyli, Welcome to r/Parenting!

This is a reminder to please behave respectfully to one another. We are a diverse community discussing a topic with a lot of variables. It's important to remember that differences in opinion, culture, and social norms are common and make us unique.

Let’s use our Playground Etiquette in the comments! Model good behavior (show others how they should treat you), Watch your language (be mindful of negative or hurtful comments), No roughhousing (it might be fun, but we don’t want anyone to get hurt), No bullying (let’s not make people afraid to participate), Stay away from dangerous areas (stay away from off-limits topics). 

Please [review our rules](https://www.reddit.com/r/Parenting/wiki/parenting_subreddit_rules/) before participating. 

Report rule-breaking content, and be kind to each other.


*I am a bot, and this action was performed automatically. Please [contact the moderators of this subreddit](/message/compose/?to=/r/Parenting) if you have any questions or concerns.*"
"7-year-old daughter won't stop crying about elementary school after first week
My daughter (7) just started elementary school last week, and it's been incredibly difficult. Every morning is a battle of tears, refusals, and meltdowns. Even after school, she's emotional and exhausted.

We've tried talking about her specific fears, established a consistent routine, stayed positive about school, and I've even resorted to bribing her with treats and special snacks. Nothing seems to help the crying episodes.

Her teacher says she eventually calms down after I leave, but starting each day with my child so distressed is breaking my heart.

For parents who've navigated this: Does it get better? How long did your child take to adjust? Any specific strategies that worked for you? I'm starting to think bribing with food isn't the right approach, but I'm desperate for solutions.

I'm looking for both reassurance and practical advice - I'm exhausted and worried this might indicate a bigger issue than just normal transition anxiety.","I feel like at 7 she should be able to articulate what she dislikes,  and maybe some ideas about what might make it better. 

Does she miss you? Does she hate school? Is she tired or hungry? Are the other kids mean? Would she rather be at home watching TV? 

What did she do up until 7? Surely this isn't her first time in an organized setting? is this her first time in school?"
"I lost my cool on my 8 year old. Need help
My daughter just turned 8 yesterday & I’ve been having a lot of issues with her for a while now. She really thinks this is her world & everyone else is just living in it. She does not listen, she talks back, she whines & yells, she has issues in school (talking in class & interrupting). Tonight we did our bedtime routine. I told her to wash up, go to the bathroom, put pj’s on, grab a snack & a water so she can get to sleep. She finishes her snack, goes in the kitchen to grab a juice. I told her no juice, just water because it’s so late & we’ve talked about how juice isn’t a good option before bed because of the sugar. She stomped her feet on the floor, upset because “it’s not fair.” So I sent her to bed, with nothing. I’ve tried so many different things over the years. Making different types of charts (chore charts, reward charts, charts for evening schedules, etc) I’ve taken away toys, grounded her, taken away electronics, offered positive rewards/reinforcements, I’ve read & read on how to do things differently ex: letting her have choices- do you want to do your homework/shower/clean up now or in 10 minutes? & nothing is working. Her dad is not really involved in her life (his choice), but our life is stable. I make decent money, we’ve lived in the same place since she was 2.5, I’ve been with my SO for 3 years. I did recently have a baby in May, but these issues have been going on long before I was pregnant. I’ll admit - I am at fault. She’s extremely spoiled & gets everything she wants all the time. I just wanted her to have what I didn’t have growing up but I fear that I have really messed up. I don’t know what else to do, I’ll take any advice. I have a feeling she is “neurospicy” but the evaluation has determined that she is not.","If all she said is “it’s not fair!” With a stomp, I’d let it go.

Because it does suck sometimes.  Mom seems to be able to eat what she wants when she wants, I don’t!  It’s the definition of unfair!

There is literally nothing in your post that makes me concerned at all, unless there are bigger things you’re leaving out Echo the consistency on the rewards and punishments"
"Take a moment to appreciate your kids
I was at the playground with my son yesterday . Kids were running everywhere, parents looked worn out after the long weekend, most scrolling on their phones. Then one boy came up and started playing with my son, who is non-verbal autistic.This kid talked a mile a minute, full of curiosity and energy. I joined in the conversation, and it turned into such a warm moment.


Sometimes I wish my son could talk to me, tell me what he’s thinking, or share little stories about his day.","As a fellow mom to a non verbal 9yo, I feel you 🫶🏼 it took a long time for me to understand the need to grieve the son I thought I would have, and to be able to appreciate the things we all take for granted Tell me about it. Similar situation here except my kid actually _wants_ to communicate. Simple exchanges can be this laborious mixture of sign language and using her talker and pointing to things…and then I’ll spend a weekend around a typical toddler and melt with envy at how fluid these exchanges could be."
"Nursery crying
So we are on month 3 of trying to do nursery 3 times a week. And every morning is a battle trying to get my son to go and play and let me leave without tears. I have heard him crying for me as I walk down the hill towards my car (forest school) 
He’s had issues with a little girl there who he says hits him and it seems to be playing on his mind at home too. It has been addressed to teachers who tell me they are trying to seperate them. 



But every morning it’s screaming crying, u get photos to show he’s ok not long after but the drop offs are killing me, how long does this last? 


Not sure if it matters much but I’m now a single mum but was a stay at home mum since he was born really only just returning to education now hence the 3 days at nursery. 

Is there anything I can do to make it better for him?","Hey /u/Excellent-Egg484! It looks like you might be new here. 

Important issues are addressed in the [Sub Wikis](https://www.reddit.com/r/Parenting/wiki/index/). They offer a variety of support for different ages, stages, and topics.

Please make yourself familiar with the [Community Rules](https://www.reddit.com/r/Parenting/wiki/parenting_subreddit_rules/). 


*I am a bot, and this action was performed automatically. Please [contact the moderators of this subreddit](/message/compose/?to=/r/Parenting) if you have any questions or concerns.* Maybe at first, just until the crying and tantrums stop, tell your little boy that once he’s done and you pick him up, you’ll do something special together. Go to the park. Go get some ice cream. Get a treat from the gas station. It’s the little things. I used to love when my mom would pick me up as a kid and surprise me with things like this. He’s a little boy, so I guarantee you even just bringing him to a gas station and letting him pick out a treat will be exciting for him. Even if it’s a small one. Going to school or nursery or whatever, for a young child, can be stressful at first because the child has been with you every second of every day up until these moments. 

Tell him “okay, buddy. I know you’re scared for mommy to leave you at nursery but I need you to be a good boy. If you be a good boy, mommy will bring you to get ice cream together after I pick you up”. Positive reinforcement is key here for young minds. Teach him that yes he won’t be seeing you for a little bit, but you’re not leaving him forever and once you pick him up, you will spend great time together and do things together. The kid is anxious for you to leave. If you just keep showing him that you’re coming back for him (obviously, but in his mind it might not be so obvious because he’s a baby) he won’t fight you forever. It’s just new for him."
"My 4 year old daughter won't allow me to participate in bedtime routine.
I'm a father of a 4 year old daughter and 2 year old son.

For about 3 weeks now my 4 year old daughter is excluding me from the bedtime routine. She won't let me help brush her teeth, dress her in pajamas, take her to the restroom, participate in bedtime stories/ books. She demands her mother everytime to the point of absolute meltdown. I'm talking on the floor flailing, kicking, screaming tantrum if my wife isn't the ringleader. She'll get down right nasty towards me telling she hates me, doesn't love me, doesn't want me.

So I've started just handling our 2 year old for bedtime with to avoid the unnecessary issues. But it seems so pointed and its eating away at me because it used to be a really special time for me and my daughter. 

I want to fix the issue but have no idea on where to start and I fear that if we don't do something that attitude is going to start bleeding into more of our day.","First, I wouldn't be worried about the attitude bleeding into the rest of the day. Four year olds are peculiar creatures with fascinating opinions that are completely illogical to us and entirely logical to them. 




Second while some people might think this is wrong"
"Single mom after betrayal, trying to stay strong for my baby
I (31F) was about 9 months postpartum when my fiancé (33M) I’ve been with almost 6 years started cheating. At the time, I couldn’t understand why he had suddenly become so cold and distant. He stopped helping with the baby and basically left me to do everything alone. I thought he was struggling with mental health, but the truth was he had another woman.

When I finally found out, he cried and swore it was over with her. Days later, he asked me to take our baby and go stay at my parents’ so he could “be alone.” Instead, he went back to her. Since then, it’s been nothing but lies, empty promises, and him choosing her over us.

I’m raising our daughter basically on my own, while he comes in and out of her life. He’ll visit, say he misses me, apologize, and talk about wanting to “fix our family” — but then he goes right back to her. I know I shouldn’t even consider going back, but sometimes I’m so lonely and hurt that I’m tempted. I miss the idea of us being a family, even though I know the reality was him abandoning me and our baby.

I guess I’m just struggling. I want my daughter to grow up with stability and love, and I don’t want to model a toxic relationship for her. I know logically we deserve so much better than a man who lies, cheats, and runs from responsibility. But emotionally, it’s hard.
For those of you who have been through something similar — how did you find strength and move forward as a single parent? How do you let go of the fantasy of a perfect family and embrace building a healthier life for your child instead?","Went through this myself. I think I would’ve ended up staying except my ex ultimately left me for the other woman. Now I am so, so grateful he left. Being a single mom was hard. And lonely. And sometimes I still feel sad my daughter didn’t get her mom and dad together. But she told me herself the other day (I mentioned my parents got divorced when I was 5) and she said she was so happy she didn’t know any different than her parents being split basically. She was really sad I was 5 and felt like I lost something. For whatever it’s worth she’s 8 and well adjusted and wonderful. 

It took me years to heal and it was hell. But now I’m in a good place and remarried and it made me strong as hell too. It's hard, I won't lie. But ultimately,  it worked out for the best. My daughter was 5 months old when my ex started the affair. I tried to make it work at first, but realized I would never be able to trust or forgive him. I decided it was better to just end it and move on. I bought a house and made the stability I wanted for my child. She is happy and thriving and I am at peace knowing I made the right decision."
"Melted heart
My daughter is 13 months old and we have her bedroom fully baby proofed. Shes crawling and we have our eyes on her when she comes in the living area. Every door in the hallway is always closed so she can go straight down to her bedroom. 

Today she laughed and just crawled off straight down her room to play. First time she’s done it and she pure happiness just melted my heart. 

That is all.","/u/bookwormingdelight, Welcome to r/Parenting!

This is a reminder to please behave respectfully to one another. We are a diverse community discussing a topic with a lot of variables. It's important to remember that differences in opinion, culture, and social norms are common and make us unique.

Let’s use our Playground Etiquette in the comments! Model good behavior (show others how they should treat you), Watch your language (be mindful of negative or hurtful comments), No roughhousing (it might be fun, but we don’t want anyone to get hurt), No bullying (let’s not make people afraid to participate), Stay away from dangerous areas (stay away from off-limits topics). 

Please [review our rules](https://www.reddit.com/r/Parenting/wiki/parenting_subreddit_rules/) before participating. 

Report rule-breaking content, and be kind to each other.


*I am a bot, and this action was performed automatically. Please [contact the moderators of this subreddit](/message/compose/?to=/r/Parenting) if you have any questions or concerns.*"
"Am I biased? My kiddo bites in daycare
As the title says, my kid (2 y/o this month) bit another toddler in daycare today. This is the fourth time it's happened. The first time was nearing 2 months ago, and daycare told us right away, sent an incident report, all that. The second time it happened was a couple weeks later. Daycare told us in person during pick up; saying that my child was having a hard time sharing, screamed, hit, fought his nap, and had bit again. The next day at pick up, daycare gave me a letter that said he had bit again and laid out the incidents of that day and the day before, saying we had one month to see improvement or he would be terminated from the program.

I totally understand the provider's worries. My kid was constantly bitten at his last daycare (part of the reason we switched) and it was so hard to know that someone hurt my baby when I couldnt help him. If I were in the daycare's shoes, I would want to be strict with biting too. Knowing that, I took this very seriously. My S/O and I came up with a plan to address behaviors at home better, to make our child share more at home, we got him exposed to more toddlers his age at play dates, and even asked all our extended family to be firm when they noticed he threw a fit or refused to share with them too.

My child made marked improvements in the month that his since passed! As far as I was aware, there had not been any more behaviors or biting at daycare, my S/O and I even made efforts to check in with the provider every day to see if anything had occurred or if we needed to take him home early, always met with ""no, he's having a great day! :)"". I felt confident that we would make it through the month's probation bite free and he would be allowed to stay. 

...until today. I got the message that my child bit for the fourth time and my heart sank:
""This seemed unprovoked and your child was having a great day up until this moment, also all week we haven't had any unusual melt downs or incidents like this. However it does concern me that he wants to bite when angry or doesn't get what he wants especially since  an infant will be joining daycare tomorrow. At some point I have to stop allowing this in my daycare and the next time your child bites another child I will provide a letter of termination.""

Since this is the anonymous internet, I have to admit that I don't agree with the provider on this. Yes, I understand that biting is bad, but after working directly with the provider, working at home, and seeing serious improvements, I feel sort of shocked that this incident is the last straw. I see it as a slip-up of course, but to after nearly 4 weeks with no issues, I expected a little more grace about it. 

I also feel hurt personally. I've made a lot of effort to correct these behaviors, and I genuinely don't think I'm raising a bad kid. For the most part, he's very happy, curious, funny, and even polite. Yes, he has meltdowns when he doesn't get what he wants, but don't all almost-two years olds?? Does this punishment fit the crime of being an emotionally immature toddler? I feel like I've been very neutral and put in a lot of work to try to fix this situation. That's why I need your help: am I being too biased by taking my child's side here? Does an almost 2 year old deserve termination for 4 biting instances over 2 months?","Your kid is not a bad kid and you are not a bad parent, but there is a limit to how many times they can allow this to happen before the provider has to act to protect the other children. Honestly I think it’s pretty fair. Five unprovoked bite incidents is more than my children’s daycare would have allowed. Yes sorry but if your kid bit my kid I would be livid and people pay a lot of money to put their kids in daycare they don’t deserve to be bit by your child"
