post,comment
"Adult shampoo
My daughter is 7 and has thin curly hair that gets tangled very easy (it’s also on the dry side.) I was thinking of trying a shampoo I use, but I’m not sure if it’ll affect her hair. Would it be safe to use a non kid shampoo for her?","Kids shampoos vs adult shampoo (generally, not all the time!) come down to a few things. Being “tear free”, smelling like bubble gum, 2/3/17-in-one products or any combination there of. A lot of adult shampoo/conditioner has a targeted purpose retain color, fix damage, add moisture, dandruff, etc. 

I would say as long as it’s not a produce that’s “clarifying” in nature (because those can burn little scalps!) and you are careful about the eyes, it’s probably fine. Double check ingredients if you are unsure."
"Difficult 5 year old
Need some advice from parents who have dealt with this and had results.

My son is five and is very difficult. He is very smart in ways that he understands things that you would never think he is paying attention to, and you can’t get anything past him. He is very deep and empathetic, sensitive. He likes to feel like he is helping. But he won’t learn simple things like letters, or numbers. Sometimes he just doesn’t want to seems like. We learned this week that his vision has been bad he is farsighted and is +2. I’m hoping this will help with his learning once we get his glasses in .. Has any one had this happen and seen a change in behavior? 

Also, 
Everything every day is a battle simple things like brushing your teeth, or just anything I ask him to do (or not to do) is like a war. He never just goes with the flow, or is easy going. How did you deal with a child like this. I know it is his personality and it’s not like I can change that. I’m worried his stubbornness is going to get the best of him. . especially when he’s older 

How do I get him to listen to me, follow instructions and want to learn.","I have a super smart 5 year old who CANNOT be ordered to do anything. He needs convincing. Maybe yours is the same? This is a tough age for setting expectations and maturity to follow through. My son did not like drawing or coloring or anything academic going into Kindergarten, despite a lot of trying. 

I did a few things to tackle this, and one of the easiest things was really committing to goal-based behavior, like using a star chart. It looks like a calendar on a poster board; basically, all of the behaviors I want him to do (brush teeth, put shoes away, wash hands, color a picture, do 5 addition problems) are a star sticker for that day. You can write the goal or use a picture. 

Then there are rewards for meeting goals, like 50 stars is a new small toy, etc. And it really helps to *not* give rewards except when earned. In a cool way, it sounds like your son might come to enjoy the challenges. We started basic, adding achievements and behaviors as we went. Over time, this was a really helpful part of resetting expectations for us. 

Good luck OP, it gets better"
"3 year old refusing meat / “animal” shaped products
My daughter just turned 3 and although she’s been quite the picky eater since turning two, she recently started refusing to eat chicken and ground beef which were her staples. Not only is she not wanting to eat meat (which she doesn’t realize comes from actual animals at this point), she also won’t eat animal crackers despite liking them because she doesn’t want to eat animals. we don’t buy her crackers shaped as animals anymore, such as the trader joe’s chocolate cats or animal graham crackers bc all of a sudden she doesn’t want to eat something shaped as an animal. she had a little bear birthday party and didn’t want to eat the little bear character cookies for this reason as well.

her grandma keeps making comments saying it’s weird she is like that and she’s never met another child who won’t eat animal shaped things for this reason. she also says “oh her heart will be so broken when she learns what chicken is”

this totally isn’t a huge issue right now, she is so sweet and obsessed with animals so it makes sense for her to feel this way (although I think it’s kind of young). I’m just slightly worried about her learning that meat is from animals and I don’t know what I would feed her because she is so picky right now. has anyone else experienced this with their little one? how do I go about it?","This is not weird at all.

My daughter doesn't like most meat, started at about 3, she's 5 now.  She will eat animal shaped things, but she just doesn't enjoy meat.

We are not forcing her.  There are plenty of other sources of protein. My daughter eats edamame, cheese, and nuts. Some people just care more about animals. It’s sweet and you should be proud of her empathy. I get the animal shaped thing is annoying, maybe just keep reinforcing its pretend and for fun, like when you make a smiley face pancake you’re not eating a person. But maybe you should try out some vegetarian meals just in case she keeps up this trait in the future :) Feel free to dm for recipes!!"
"Oh the places you’ll go
I remember years ago seeing a post either on tumblr or Twitter about parents buying a copy of oh the places you’ll go and giving it to their kids teachers to write a note in it at the end of the school year and it would be given to the kid as a graduation gift. I always like that idea but as an educator I always thought it was too much after elementary school kids have multiple teachers then and teachers have too much to deal with. But I still love the thought behind it. So my question is do you think if would be just as impactful and sweet if instead of teachers and stuff. My daughter’s father and I wrote her a note each year on her birthday in her copy of the book and it is her gift on her 18th birthday since that’s when she’s an “adult”.","Hey /u/Hairy-Loquat-9219! It looks like you might be new here. 

Important issues are addressed in the [Sub Wikis](https://www.reddit.com/r/Parenting/wiki/index/). They offer a variety of support for different ages, stages, and topics.

Please make yourself familiar with the [Community Rules](https://www.reddit.com/r/Parenting/wiki/parenting_subreddit_rules/). 


*I am a bot, and this action was performed automatically. Please [contact the moderators of this subreddit](/message/compose/?to=/r/Parenting) if you have any questions or concerns.* Stick to English teachers in HS maybe? Or pick one of their favorite teachers of any subject each year as you hear them talk about it?"
"How do I get my 4 year old to listen.. like AT ALL!!
Title say it all but basically my 4 year old will simply not listen to anything I say unless I raise my voice or completely lose it. I try asking properly i.e. get his attention, down to his level, be clear in my statements etc. I always give a heads up like "" ok, it's bath time in 5 minutes so when I say it's time, you need to get in the bath, is that clear?"" He'll with ignore me (and if so, I will get his attention again and re-phrase it so I am not repeating) or else will say ok but then when I say ok bath time he just doesn't move or finds a million and one excuses. Until I finally raise my voice and say something along the lines of OK. BATH TIME. NOW! and then he'll go ""ok ok"" as though meaning ok ok calm down woman (he obviously doesn't say that).

I am tired or bribing and threatening, I am tired of feeling invisible, I am worried I am raising a rude and arrogant child and someone who doesn't respect others. I hate having to shout but if I don't he simply won't listen. 

The worst part is when I have to do it at bedtime.. I always lay with him until he falls asleep and he will jump around, joke, invent things, everything but wind down and sleep. I have to (once again) raise my voice and say ok now we need to stop! I said that's enough! Which makes me feel SO BAD for sending him to sleep with me raising my voice as the last thing in his head.. 

Please share any tips that can help because I am honestly not liking this version of a mother I am becoming. I do not need to threaten my son that I will take his toys away if he doesn't pick them up or that I will not allow him to watch TV if he doesn't eat his dinner! Especially when it comes to food, I've always tried to get him to listen to his body but if I don't push him into taking every single bite, he will honestly be running on air...","I don't know what it looks like in your home but from what you've described, I am getting the impression that he knows it isn't serious until you raise your voice. If he won't turn off the TV to eat dinner no matter how many times you tell him until finally you yell ""Turn off the TV and eat or you won't have TV for the rest of the night!"" Well, now a consequence is involved. When you ask him calmly he still has some room to ignore you but knows that once the raised voice comes out you mean business. You need to always mean business. You can tell him in your nice voice ""The TV needs to turn off so you can have dinner. If the TV is too much of a distraction, then it means we need a break and won't be watching for the rest of the night."" And then follow through. He still doesnt listen? Turn it off and put the remote up. Right now he thinks that until you yell you won't actually do anything about it. This is one example but I mean it with anything. You dont have to yell about consequences to enforce them. He gets one warning, he makes his choice, and you respond to that choice. It seems like it's a power struggle with you almost begging him to listen and negotiating and finally yell and put your foot down and so he is aware it doesnt matter if he listens until that point. Put your foot down from the beginning. The bedtime thing: if my 8 year old messes about when he's meant to be going to sleep I tell him I will not sit with him if he messes around, and I absolutely follow through on that threat. Needless to say he very rarely misbehaves when it's sleep time now. However, this works for us because he wants me to sit with him until he falls asleep, this is less likely to work if your kid isn't actually that bothered about having someone there as they fall asleep"
"Discord
Hi I found out my son (13M) was on discord talking to completed random people. There was some troubling things on it, and of course who knows who anyone else is could be scammers or adults pretending to be kids. My rule is he’s welcome to talk to ppl online as long as he also knows them in real life. So I’m making him delete his account and he’s only to use his computer outside of his room. He also lied to me this morning about talking to someone when I could hear him and said it was someone from school and later admitted it wasn’t. He’s having trouble connecting to people in school so I’m telling him to try clubs and get involved in stuff to connect. Any advice from other parents would be welcome.","Not a mother yet, bus a Psychologist here 🥰 what do you call disturbing things?
One thing you can do is letting him game with his online friends if they agree to say hi to you with the camera on and you approve the kid on the other side. Now is a really important time to build trust and boundaries, so, if you can do that, he might trust that you can handle some truths and be more open with you. Of course, this is just a sugestion ✨️ Discord is like reddit"
"Tantrums
My daughter is 10 days from being 1. Normally such a happy and chill baby, but she wants what she wants. she had her first ""tantrum"" today. I wouldnt let her climb on some broken stairs. When I set her down she screamed and threw anything she could reach. I ended up picking her up and saying something like ""thats so frustrating! But those stairs are not safe for climbing"". 
Looking for any management tips. Her brother has had maybe 3 tantrums his whole and they started when he was three, so i dont have much experience in managing emotions.","/u/Key-Significance1876, Welcome to r/Parenting!

This is a reminder to please behave respectfully to one another. We are a diverse community discussing a topic with a lot of variables. It's important to remember that differences in opinion, culture, and social norms are common and make us unique.

Let’s use our Playground Etiquette in the comments! Model good behavior (show others how they should treat you), Watch your language (be mindful of negative or hurtful comments), No roughhousing (it might be fun, but we don’t want anyone to get hurt), No bullying (let’s not make people afraid to participate), Stay away from dangerous areas (stay away from off-limits topics). 

Please [review our rules](https://www.reddit.com/r/Parenting/wiki/parenting_subreddit_rules/) before participating. 

Report rule-breaking content, and be kind to each other.


*I am a bot, and this action was performed automatically. Please [contact the moderators of this subreddit](/message/compose/?to=/r/Parenting) if you have any questions or concerns.* 1 year old don't have the linguistic or cognitive development to understand or utilize calm down strategies. At this age its all remove and distract. 


Remove from the unsafe thing and replace it with something your child is motivated by or loves (no food though)."
"Do kids never hangout anymore?
No Idea if this is the right sub for this but I’m frustrated. 

Do kids really not hangout anymore? My son tries to hangout with his friends, they make plans and nothing ever comes of it. 

Is this normal?","This is the biggest mystery to me. I have a teenage and pre-teenage daughter. I’m all of the time encouraging them to invite their friends over. Offering to have a fire, order pizza, etc. They almost always brush me off, replying with “eh, maybe, I don’t know”. Then nothing ever comes of it. It’s sad for me to watch. I used to live for hanging out with my friends on the weekends.

I should add that they both have numerous friends, they just never seem interested in physically hanging out. My daughter does occasionally. 

It's nothing like when I was a teenager though."
"Music recommendations for 18-month old boy
Want to start getting my son used to listening to real music (it's all been wheels on the bus and teletubbies so far). 

Music has always been a passion of mine and I'd like my boy to develop a keen ear for music too, and I figured it's probably good to start early.

Being a first time father I've never really considered what aspects of the music I love might appeal to a young child, but I suppose a good beat and catchy hook will do it. My mind just seems to go blank when I go to choose something and then I put something on and he just cries until I change it. (I suppose he's not ready for Nirvana and Soundgarden yet).

Have any parents out there got any song recs that instantly get your kid bopping? I developed my own music tastes in the 90s as a teen, so I'm thinking music along the lines of grunge/alternative and/or 60s/70s rock too. The only one I did find so far was jump around by house of pain. Really looking to find enough to make up a good playlist on Youtube that we can listen to together. 

Thanks in advance!","My husband found out early on that my son loved Black Betty by Ram Jam. He would instantly stop fussing and just bounce around. We found that both kids responded well to songs with good drum beats. I'm not musically inclined so you will have to forgive my explanation, but anything with a dramatic change in tempo or build up resonated with them. So there were lots of Queen, Journey and 80's ballads played in our house. I’ve been listening to loads of different kinds of music with my 2.5 year old. Of course we do this nursery rhymes stuff, but that’s gets old very fast for adult ears. 

On the kids music side, soundtracks like Moana etc. are more palatable. I highly recommend Nick Cope (British children’s musician). His songs are fun for everyone. 

We do a lot of classical, and relaxing jazz"
"My tweenage son called me out for looking something up on Google Gemini.
Somewhere my daughter (9) learned about polio. She brought it up at the dinner table and asked if we knew about it. My wife confirmed and told her that we have an uncle and and aunt that had polio as children. I told her that she doesn't have to worry about polio because she was  vaccinated and it's been eradicated in the US. She asked if other countries still have it. I didn't know the answer so I pulled it my cell phone and asked Google Gemini what countries still have polio. I started reading the response and my son (12) jumped in with all of the dripping saracasm he could muster and said ""According to AI...""

I said, ""That's fair."" And then tapped on a more reliable source to continue reading the answer. (Afghanistan and Pakistan if you are interested.)

I was quite proud of both of them.","I'm right there with your kid, I miss Google being the answer finding machine and not the answer giving machine. 

Back in the day, I remember being told Wikipedia wasn't a reliable source because it was community edited, but my argument was it gave sources you could follow back to verify. 

The AI results we currently get don't give sources and hide their bias and I hate it. I was picking image tokens to use for our D&D session, and my 14 year old son pointed out that the one I liked was AI.  I asked ""so what?"", and he said ""don't use it, no one put any effort into it"". 

Like you, I was proud of him."
"Uproot kid to become homeowners, or stay put in a state where we will never own a home?
My son is in 5th grade, loves his friends and loves our neighborhood. He’s very happy. My husband and and I would like to leave our current HCOL state to become first time homeowners in another state. I’ve explained this to my son. He gets a little bummed, but then very excited at the idea of having a big house with a big backyard and his own room. Nothing is getting cheaper. The market isn’t going to crash. A big reason for wanting to make the move next summer, is because it will be his first year of middle school, which may be tough, but at least he is starting at the beginning with the rest of the 3 feeder schools that won’t know each other. Lastly, he is very outgoing, makes friends easily, but I still don’t want to hurt him or ruin his life or self esteem. Advice?","Move. Kids are resilient and he will adapt. Sounds like a better life with home ownership. 

This is not a child’s decision. It is an adult decision. Uproot kid to become homeowner. This is a silly question. Kids will make more friends. He'll be incredibly thankful in 30+ years when hes lined up to inherit a home instead of keeping some 5th grade friends thaat he wont remember when hes in college"
"How do i tell kids being mean to my kid to stop being an asshole?
For context, my daughter is 8 and was being picked on by boys down the street, probably 10 or 11 years old. Calling her names from a distance. I went down and told them to cut it out. 20 minutes later it happens again so i turn up the rage a bit and told them how tough they were from a distance but now they are quiet as could be. One of them was suuuuper mouthy and seemed like nothing i said would shut him up. Wondering how other parents handle this situation? I get that boys will be boys but im gonna stick up for my kid 100% of the time and there are only so many options when dealing with pre teens.","Controversial opinion that I'm sure will earn downvotes: I would give your daughter ammo and let her sling more hurtful insults back. This is how my mom taught us. She used to always tell me that bullies just need to feel the pain of their own medicine and that usually puts a stop to it. She was right every time. I never like to pick on anyone's physical appearance, but when it comes to my kid, shrug. For example; This older girl kept picking on me for my hairy legs when I was 8. My mom told me to tell her that ""I can shave my legs, but you can't shave off that big ugly nose."" I know it's horrible, but she asked for it and she never messed with me again after that. We rode the same bus all the way into high school. She never bothered me again and I was nice to her going forward. 

Those kids don't give a shit about you being upset with them. They probably find it funny. Speak with their parents."
"How should I tell my son about his dad?
So my ex boyfriend and I got pregnant a few months into knowing each other. We decided to try and build our family and be with each other. It was okay until I was 8 months pregnant and left after the emotional abuse turned physical. He was born in July with my last name & no father listed and because of everything that happened I am pursuing charges against his father for the abuse. So the father has not reached out whatsoever to attempt to connect with his son. Him and his family likely want nothing to do with us. I am also attempting to get child support from him once paternity is established by court. 

Anyways, assuming that everything goes well and his dad attempts to be in his son’s life one day, how would I go about telling my son what happened?
What do I even say when he’s old enough to realize he doesn’t have a father and asks about it? I really wouldn’t like to talk badly about his dad to him, but it would make me uncomfortable if his dad got visitation or custody and the unknown of if he is telling my son bad things about me which would be false. 

I guess I just don’t know what I should do when he’s old enough and asks. I could sprinkle some truth in there but also avoid speaking badly about him maybe? Or just be fully honest and say his own dad hit me when I was pregnant with him? 
Any advice would be helpful. I’m new at this, a first time single mom at 23 y/o. Thanks in advance","Dont hide the truth. 

Keep all your papers and records and show him when old enough if he wants proof

When hes younger and asks about him just say he wasn't nice and did bad things. [removed]"
"Keeping my 16 yo entitled daughter grounded
Keeping my entitled daughter grounded

First time posting in this reddit so please bare with me.  Divorced dad to a 16 yo daughter.  My daughter has a great heart but she's becoming very entitled.  Her mother and I have struggled with this the past few years and I'm stuck what to do.  My daughter suffers from high anxiety as well as poor focus. She got her license back in June and since then has totaled the car she got from her mom and been in two minor accidents with a car she was given by a friend.  I spent half the day today pulling dents and trying get the doors straight.  If you know anything about body work it's an ugly process and it usually looks worse before it gets better.  After grinding away some paint to weld onto the metal to straighter,  it's better but it's only step one.  Today when she went to take her car to work,  she asked if it would be fixed by tomorrow,  obviously not. Her next response was,  ""I have to drive my car like that to school?"". I was really taken aback by her attitude towards my hard work.  She goes to a school where money is plentiful and I certainly have the funds to buy her a new car,  but am I wrong for being so pissed by this attitude? I was raised blue collar by parents that worked hard for everything they wanted in life,  I am the same way.  I'm trying to teach her appreciation for things in life but she doesn't get it.  I hate her driving a beat up car but she did this to herself.  I know the comments she'll get from the other kids at school may be cruel and as her dad i don't want her to face that either. Very stuck right now.  Thanks for taking the time to read all this.","If she’s gotten into that many accidents within the first year of having her license she just isn’t ready to drive. Take that car away! No more car and no more driving at all without mom or dad in the passenger seat. She obviously doesn’t realize the severity of wrecking not one, but two cars. Tell her if she’s embarrassed by the state of the car, she should learn to be a better driver before being allowed to use another. Driving is a privilege. It’s been less than 3 months and she’s had 3 accidents? She’s not ready to drive."
